obligation_id,description,required_modules,failure_class_if_missing
O1_LINGUISTIC_ADDRESSABILITY,The system must have a discrete or discretizable linguistic token/symbol space.,TOKEN_OR_SYMBOL_SPACE,non-linguistic vector processor or non-token text-adjacent tool
O2_CONTEXT_CONDITIONABILITY,The system must condition outputs on linguistic context rather than only global priors.,TOKEN_OR_SYMBOL_SPACE;CONTEXT_CONDITIONING_STATE;LEARNED_PARAMETERIZED_TRANSFORM,context-free historical language model or lookup process
O3_LEARNED_GENERALIZING_TRANSFORM,The system must contain a learned high-capacity transform fitted to language data.,LEARNED_PARAMETERIZED_TRANSFORM;SEQUENCE_MODELING_OBJECTIVE_OR_EQUIVALENT_FITTING_CRITERION,"rule base, retrieval index, small table, or unfitted transform"
O4_CONDITIONAL_LINGUISTIC_ALTERNATIVES,"The system must expose a context-conditioned surface over linguistic alternatives: probabilities, scores, selections, masks, or equivalent.",CONTEXT_CONDITIONING_STATE;LEARNED_PARAMETERIZED_TRANSFORM;CONDITIONAL_LINGUISTIC_OUTPUT_SURFACE,"encoder-only representation, embedding engine, or latent feature extractor without conditional linguistic output alternatives"
O5_SEQUENCE_LEVEL_LANGUAGE_FIT,The system must be fitted to language sequences or an equivalent generative/infilling/denoising text criterion.,TOKEN_OR_SYMBOL_SPACE;SEQUENCE_MODELING_OBJECTIVE_OR_EQUIVALENT_FITTING_CRITERION,"classifier, retriever, ranker, or contrastive embedding model"
O6_OPERATIONAL_EMISSION_PATH,An operational LLM system must have a path from the conditional linguistic surface to observable token/text emission or scoring output.,TOKEN_OR_SYMBOL_SPACE;CONDITIONAL_LINGUISTIC_OUTPUT_SURFACE;DECODING_OR_EMISSION_INTERFACE,"isolated checkpoint tensor, latent scorer, or non-operational model core"
